{"$schema":"https://json-schema.org/draft/2020-12/schema","$id":"https://juanenrac.github.io/hydra-umc-sdk/contracts/v1/capability.schema.json","title":"Capability","description":"I02: whether `target` supports `kind` at all (declared - a static manifest/descriptor claim) modeled as data distinct from whether that support was recently, actually verified (last_checked_at_utc/checked_configuration/max_age_seconds) - a declared capability with no recent, successful check is not usable, and neither is one whose check has gone stale. See is_capability_usable() in the Python reference client.","type":"object","required":["schema_version","target","kind","declared"],"properties":{"schema_version":{"const":"1.0"},"target":{"type":"object","required":["kind","id"],"properties":{"kind":{"type":"string","minLength":1},"id":{"type":"string","minLength":1}},"additionalProperties":true},"kind":{"type":"string","minLength":1,"description":"Which capability - the same vocabulary as Operation.kind."},"declared":{"type":"boolean","description":"Static: does target's own manifest/descriptor claim to support kind at all. Never proof it actually works."},"last_checked_at_utc":{"type":"string","format":"date-time"},"checked_configuration":{"type":"string","description":"Opaque fingerprint/revision of the configuration under which last_checked_at_utc's check actually ran."},"max_age_seconds":{"type":"number","exclusiveMinimum":0},"last_check_outcome":{"enum":["verified","failed","unknown"]},"last_check_reason":{"type":"string"}},"additionalProperties":true}
